{
  "$schema": "https://schemas.nuextvault.dev/extensions/manifest/v2",
  "schemaVersion": 2,
  "id": "NuExtVault.PackageStaging",
  "identityPredecessors": [ "NuTest.PackageStaging" ],
  "version": "1.2.0",
  "publisher": "NuExtVault",
  "sdk": { "minimum": "1.5.0", "maximumExclusive": "2.0.0" },
  "contracts": {
    "manifest": 2,
    "operation": 1,
    "contribution": 1,
    "route": 1,
    "capability": 1,
    "structural": 1
  },
  "state": {
    "schemaName": "package-staging",
    "schemaVersion": 1,
    "required": true
  },
  "operations": [
    {
      "id": "NuExtVault.PackageStaging.CreateGroup",
      "version": 1,
      "requestContract": "NuExtVault.PackageStaging.CreateGroupRequest.v1",
      "responseContract": "NuExtVault.PackageStaging.CreateGroupResponse.v1",
      "ownership": "new",
      "allowReplacement": false
    },
    {
      "id": "NuExtVault.PackageStaging.ListGroups",
      "version": 1,
      "requestContract": "NuExtVault.PackageStaging.ListGroupsRequest.v1",
      "responseContract": "NuExtVault.PackageStaging.ListGroupsResponse.v1",
      "ownership": "new",
      "allowReplacement": false
    },
    {
      "id": "NuExtVault.PackageStaging.GetGroup",
      "version": 1,
      "requestContract": "NuExtVault.PackageStaging.GetGroupRequest.v1",
      "responseContract": "NuExtVault.PackageStaging.GetGroupResponse.v1",
      "ownership": "new",
      "allowReplacement": false
    },
    {
      "id": "NuExtVault.PackageStaging.UploadPackage",
      "version": 1,
      "requestContract": "NuExtVault.PackageStaging.UploadPackageRequest.v1",
      "responseContract": "NuExtVault.PackageStaging.UploadPackageResponse.v1",
      "ownership": "new",
      "allowReplacement": false
    },
    {
      "id": "NuExtVault.PackageStaging.UploadSymbol",
      "version": 1,
      "requestContract": "NuExtVault.PackageStaging.UploadSymbolRequest.v1",
      "responseContract": "NuExtVault.PackageStaging.UploadSymbolResponse.v1",
      "ownership": "new",
      "allowReplacement": false
    },
    {
      "id": "NuExtVault.PackageStaging.Inspect",
      "version": 1,
      "requestContract": "NuExtVault.PackageStaging.InspectRequest.v1",
      "responseContract": "NuExtVault.PackageStaging.InspectResponse.v1",
      "ownership": "new",
      "allowReplacement": false
    },
    {
      "id": "NuExtVault.PackageStaging.Promote",
      "version": 1,
      "requestContract": "NuExtVault.PackageStaging.PromoteRequest.v1",
      "responseContract": "NuExtVault.PackageStaging.PromoteResponse.v1",
      "ownership": "new",
      "allowReplacement": false
    },
    {
      "id": "NuExtVault.PackageStaging.Reject",
      "version": 1,
      "requestContract": "NuExtVault.PackageStaging.RejectRequest.v1",
      "responseContract": "NuExtVault.PackageStaging.RejectResponse.v1",
      "ownership": "new",
      "allowReplacement": false
    },
    {
      "id": "NuExtVault.PackageStaging.Expire",
      "version": 1,
      "requestContract": "NuExtVault.PackageStaging.ExpireRequest.v1",
      "responseContract": "NuExtVault.PackageStaging.ExpireResponse.v1",
      "ownership": "new",
      "allowReplacement": false
    },
    {
      "id": "NuExtVault.PackageStaging.CompatibilityUpload",
      "version": 1,
      "requestContract": "NuExtVault.PackageStaging.CompatibilityUploadRequest.v1",
      "responseContract": "NuExtVault.PackageStaging.CompatibilityUploadResponse.v1",
      "ownership": "new",
      "allowReplacement": false
    }
  ],
  "contributions": [
    {
      "id": "NuExtVault.PackageStaging.ServiceIndex",
      "kind": "service-resource",
      "version": 1,
      "routeId": "nuextvault.staging.list-groups"
    },
    {
      "id": "NuExtVault.PackageStaging.NuGetServiceIndex",
      "kind": "service-resource",
      "version": 1,
      "routeId": "nuextvault.staging.nuget-upload",
      "resourceType": "PackageStaging",
      "resourceVersion": "1.0.0"
    }
  ],
  "routes": [
    {
      "id": "nuextvault.staging.create-group",
      "operationId": "NuExtVault.PackageStaging.CreateGroup",
      "methods": [ "PUT" ],
      "path": "/staging/groups/{groupId}",
      "access": "admin",
      "head": "none",
      "body": "bounded",
      "maximumRequestBytes": 8192,
      "maximumResponseBytes": 65536,
      "timeoutMilliseconds": 30000
    },
    {
      "id": "nuextvault.staging.list-groups",
      "operationId": "NuExtVault.PackageStaging.ListGroups",
      "methods": [ "GET" ],
      "path": "/staging/groups",
      "access": "admin",
      "head": "none",
      "body": "none",
      "maximumRequestBytes": 0,
      "maximumResponseBytes": 1048576,
      "timeoutMilliseconds": 30000
    },
    {
      "id": "nuextvault.staging.get-group",
      "operationId": "NuExtVault.PackageStaging.GetGroup",
      "methods": [ "GET" ],
      "path": "/staging/groups/{groupId}",
      "access": "admin",
      "head": "none",
      "body": "none",
      "maximumRequestBytes": 0,
      "maximumResponseBytes": 1048576,
      "timeoutMilliseconds": 30000
    },
    {
      "id": "nuextvault.staging.upload-package",
      "operationId": "NuExtVault.PackageStaging.UploadPackage",
      "methods": [ "PUT" ],
      "path": "/staging/groups/{groupId}/packages",
      "access": "admin",
      "head": "none",
      "body": "stream",
      "headers": [ "Idempotency-Key" ],
      "maximumRequestBytes": 16777216,
      "maximumResponseBytes": 65536,
      "timeoutMilliseconds": 60000
    },
    {
      "id": "nuextvault.staging.upload-symbol",
      "operationId": "NuExtVault.PackageStaging.UploadSymbol",
      "methods": [ "PUT" ],
      "path": "/staging/groups/{groupId}/packages/{packageId}/{version}/symbols",
      "access": "admin",
      "head": "none",
      "body": "stream",
      "headers": [ "Idempotency-Key" ],
      "maximumRequestBytes": 16842752,
      "maximumResponseBytes": 65536,
      "timeoutMilliseconds": 60000
    },
    {
      "id": "nuextvault.staging.inspect",
      "operationId": "NuExtVault.PackageStaging.Inspect",
      "methods": [ "GET" ],
      "path": "/staging/groups/{groupId}/packages/{packageId}/{version}",
      "access": "admin",
      "head": "none",
      "body": "none",
      "maximumRequestBytes": 0,
      "maximumResponseBytes": 65536,
      "timeoutMilliseconds": 30000
    },
    {
      "id": "nuextvault.staging.promote",
      "operationId": "NuExtVault.PackageStaging.Promote",
      "methods": [ "POST" ],
      "path": "/staging/groups/{groupId}/packages/{packageId}/{version}/promote",
      "access": "admin",
      "head": "none",
      "body": "none",
      "headers": [ "Idempotency-Key" ],
      "maximumRequestBytes": 0,
      "maximumResponseBytes": 65536,
      "timeoutMilliseconds": 120000
    },
    {
      "id": "nuextvault.staging.reject",
      "operationId": "NuExtVault.PackageStaging.Reject",
      "methods": [ "POST" ],
      "path": "/staging/groups/{groupId}/packages/{packageId}/{version}/reject",
      "access": "admin",
      "head": "none",
      "body": "bounded",
      "maximumRequestBytes": 8192,
      "maximumResponseBytes": 65536,
      "timeoutMilliseconds": 30000
    },
    {
      "id": "nuextvault.staging.expire",
      "operationId": "NuExtVault.PackageStaging.Expire",
      "methods": [ "POST" ],
      "path": "/staging/groups/{groupId}/expire",
      "access": "admin",
      "head": "none",
      "body": "none",
      "maximumRequestBytes": 0,
      "maximumResponseBytes": 65536,
      "timeoutMilliseconds": 30000
    },
    {
      "id": "nuextvault.staging.nuget-upload",
      "operationId": "NuExtVault.PackageStaging.CompatibilityUpload",
      "methods": [ "PUT" ],
      "path": "/staging/nuget/{uploadKind}",
      "access": "admin",
      "head": "none",
      "body": "stream",
      "allowsResourceBaseReference": true,
      "maximumRequestBytes": 16777216,
      "maximumResponseBytes": 65536,
      "timeoutMilliseconds": 60000
    }
  ],
  "capabilities": [
    { "name": "host.clock.read", "requirement": "required" },
    { "name": "extension-state.read", "requirement": "required" },
    { "name": "extension-state.write", "requirement": "required" },
    { "name": "packages.content.write-staged", "requirement": "required" },
    { "name": "publication.request", "requirement": "required" }
  ]
}
